id,text,title,date,president
19,"和平繁榮永續臺灣
大會主席立法院王院長、索羅門總督卡布依閣下伉儷、宏都拉斯副總統阿瓦雷茲閣下伉儷、巴拉圭副總統艾法拉閣下伉儷、聖克里斯多福副總理李察斯閣下、史瓦濟蘭王國副總理戴保羅閣下、各國祝賀代表團及駐華使節、吳副總統、連前副總統、蕭前副總統、各位院長、各位政黨領袖、各位貴賓、各位僑胞、各位鄉親父老、各位媒體與電視機前的朋友：大家早安，大家好！
一、國家生日意義深遠，七年努力成果豐碩
今天是民國104年的國慶日，讓我們一起祝中華民國生日快樂！
今天，我國朝野政黨的領袖，都出席了國慶典禮，令人欣慰。我希望這代表大家無分朝野，都認同中華民國、支持中華民國。
今年的國慶日，還有特別的意義。今年是抗戰勝利暨臺灣光復七十週年。70年前，全國軍民在國民政府的領導下，擊敗了強敵、挽救了國家、光復了臺灣、幫助了盟軍，贏得了二戰。我們今天在這裡歡慶國家的生日，不要忘記在過去120年當中，無數先烈先賢－包括許多來自臺灣的抗日志士與抗戰英雄－所付出的生命與熱血，才能讓我們今天在臺灣享有自由、安定、與繁榮的生活。
七年來，雖然政府全心全意為臺灣打拚，但是還是有一些不如人意的地方，與一些誤解，我們還是必須說明。
七年來，我們捍衛臺灣的自由民主。美國「自由之家」評定：不論人民的政治權利或公民自由，我國都與先進國家一樣，屬於自由國家。
七年來，我們實踐社會公平。照聯合國統計，臺灣「性別不平等指數」是全球最低的前五名。儘管貧富差距仍然不小，但我們的所得分配持續改善。從90年史上最高的家戶所得差距6.39倍，降到了去年的6.05倍，個人所得差距則降到3.98倍，更是14年來最低。我們已經實施回饋稅與兩稅合一減半扣抵，以改善所得分配並促進財政健全；我們即將實施房地合一實價課稅，以實現居住正義，這些都是重大改革。此外，政府已專案提供近6,400億元優惠貸款及16億元利息補貼給20萬戶購屋的家庭；提供81億元的租金補貼，給超過22萬戶租屋的家庭。加上其他措施，總計政府為67萬戶家庭支出總金額達到近440億元，這是歷史的新高，超過七年前的16倍，受惠家庭數則是22倍。
七年來，我們大力推動社會福利。我們鼓勵生育，提供305億元育嬰留職停薪津貼給34萬年輕夫妻；去年全臺新生兒也突破21萬人，是十年來的第二高；我們放寬標準，納入補助的弱勢人民，從26萬擴大到70多萬；我們推動二代健保，讓這個全球頂尖健保的財務更穩健，大多數人的保費不漲，鎖卡人數從96年的近70萬減少到現在的不到4萬，落實弱勢照顧。國民年金保險與勞保年金開辦6年了。《長期照顧服務法》已完成立法，《長期照顧保險法草案》也送到立法院，為長輩提供更周延的老年生活保障。
七年來，我們打造了更能安居樂業的環境。我國治安良好，高居世界第二，受到國際社會肯定。犯罪發生數下降近四成，破案率上升11個百分點；酒駕死亡人數下降七成；詐欺損失金額減少八成；自殺人數大幅下降，已退出十大死因之列；去年，交通事故死亡人數更是20年來最低；我國防制人口販運的績效在美國國務院評比中，連續六年維持第一級。
七年來，政府大力發展再生能源。從98年《再生能源發展條例》實施後，政府推動「千架海陸風力機」、「陽光屋頂百萬座」等政策，使我國太陽能光電的裝置容量五年來成長65倍，發電量成長了53倍；風力發電裝置容量成長1.7倍，而發電量成長2.7倍。這些成果為臺灣邁向綠能低碳社會奠定良好基礎。但是，目前這些再生能源穩定度較低，無法成為基載電力的來源，未來，政府仍然應該在節能減碳的前提下，尋找出臺灣的「最適當能源組合」，全力節能減碳。今年6月，《溫室氣體減量及管理法》通過了，讓我國跟上全球減碳趨勢。
七年來，我們用心拚經濟。根據瑞士洛桑管理學院的《世界競爭力年報》，七年來，中華民國的全球排名總平均是11.5名，這是20年來最好的成績。今年7月，美國《全球金融》雜誌公布以「購買力平價」計算的人均國內生產毛額，我國排名全球第17名，高於德國、英國、法國、日本以及韓國。勞工基本工資連續五年調漲，漲幅接近16％；實質薪資去年成長2.36%，今年上半年成長約4.4%，都是亞洲四小龍最高；我們失業率降到3.73％，是15年來最低；物價相對穩定，在四小龍中最低。而「2014年全球痛苦指數」排行，在108個國家中，臺灣名列第四低。
為因應當前經濟不景氣，兼顧國際產業發展趨勢與臺灣出口導向的特性，我們加速推動「創新驅動」的新經濟模式；並以物聯網為核心，結合雲端、大數據、電子商務應用的「生產力4.0」產業策略，以「系統整合與商品服務」為出口的新藍海，促進臺灣產業升級與經濟轉型。
二、兩岸和平廣受支持，國際空間大幅開拓
七年多來，我們推動兩岸關係和平發展，將臺灣海峽從東亞的戰爭熱點，轉變為和平大道，贏得國際社會普遍肯定。「維持現狀」已經成為臺灣共識；在座朝野政黨的領袖，也都不約而同支持「維持現狀」，確實相當難得，這也再次證明政府七年來的兩岸政策，不但沒有「親中賣臺」或「矮化主權」，反而成為民意的主流。
這七年多來，兩岸簽署了23項合作協議，主管兩岸事務的首長會面多達5次並互稱官銜；陸客來臺累計超過1,400萬人，去年一年就接近400萬人，成長10多倍；來臺陸生從823人增加到33,000人，成長40倍；兩岸簽訂《經濟合作架構協議》後，節省關稅超過25億美元，我方對大陸出口增加，受惠廠商有一半是中小企業；外銷大陸農產品更出現史上第一次順差，而且年年擴大。但臺灣對大陸出口的依存度，反而因為我們分散出口市場而下降。兩岸目前正處於隔海分治66年以來最和平繁榮的時期，與民國97年以前那種衝突對立的「現狀」，完全不同。
在國際關係方面，我們七年多來努力扮演「和平締造者」與「人道援助者」的角色，也開花結果。我們先後在101年與今年提出「東海和平倡議」與「南海和平倡議」，與日本簽訂《臺日漁業協議》，有效解決40年的釣魚臺漁業糾紛，達成「主權未讓步、漁權大進步」的目標；同時，我們與菲律賓也達成海上和平執法、事前通報、儘速釋放等共識。從海地到日本，從菲律賓到敘利亞、從西非到加勒比海、從尼泊爾到薩爾瓦多，從伊拉克到瓜地馬拉，我們提供各種救援物資、捐款或服務，哪裡有大災難，我們的人道援助就送到哪裡，這都讓受惠國人民感念在心，也讓國際社會刮目相看。
各位鄉親父老，七年來國際環境變得友善，兩岸關係的改善是主要因素，臺美關係的提升就是見證。兩岸之間，不再進行惡性競爭，擺脫了「支票簿外交」等負面的國際觀感。這是因為我們以創新的思維，同時處理「兩岸」與「國際」這兩組關係，創造出了一套嶄新的「活路外交」。兩岸關係越平穩，我們越有條件推動「目的正當、過程合法、執行有效」的援外政策，受到國際社會的尊敬與讚許也越多，這是一個互惠雙贏的良性循環。
我國已經連續七年以適當名稱、正式身分、部長層級、平等待遇、直接聯絡等方式，參加睽違38年的「世界衛生大會」；我們也參加了睽違42年的「國際民航組織」大會，加入了世貿組織架構下的《政府採購協定》，這都是從前未能做到的。民國99年，我們與大陸簽署了《兩岸經濟合作架構協議》；100年至今，我們與日本簽訂《投資保障與促進協議》等25個協議；102年3月，我國與美國恢復在《貿易暨投資架構協定》之下的協商；7月與紐西蘭簽訂《臺紐經濟合作協定》，11月與新加坡簽訂《臺星經濟夥伴協定》，這些發展，每一項都是突破。未來，我們還要加入剛剛完成談判的《跨太平洋夥伴協定》，以及《區域全面經濟夥伴協定》，加速參與區域經濟整合。
七年來，中華民國的國際形象變好了，我國觀光客更受到世界各國的歡迎。從民國86年到我上任前的96年，全球只有54個國家與地區，給予我國人民免簽證、落地簽證或簽證便利，而現在已經擴大到153個，增加了99個，這是空前的成長；境外旅客也更喜歡來臺灣，去年已經達到991萬人，是我上任前的2.6倍，成長率全球第二，創造超過4,000億臺幣的觀光收入。這些也是前所未有的。七年前，兩岸關係與國際關係彼此原是惡性循環，我們把它扭轉為良性循環！現在，臺灣多數人要維持的是什麼樣的現狀？就是這個良性循環的「現狀」！
三、兩岸現狀維持不易，盼後人延續目前作法
我們在兩岸關係獲得了可觀的成果，但是，這個現狀，未來能夠維持嗎？坦白說，我確實很憂慮。因為維持現狀不是從天而降，不能視為當然。兩岸關係必須堅持原則，才能維持現狀；一旦偏離原則，現狀就會改變，又回到七年多前兩岸關係停滯、國際關係生變的困境。
以下就是兩岸關係七年來得以維持現狀的五項原則：
第一、在中華民國憲法架構下，維持兩岸「不統、不獨、不武」的現狀。這是有近八成民意支持的「臺灣共識」。
第二、在「九二共識、一中各表」的基礎上，推動兩岸和平發展。這是由臺灣提出、大陸接受、有五成以上民意支持的「兩岸共識」。
第三、「以臺灣為主，對人民有利」的交流原則。
第四、「先急後緩，先易後難，先經後政」的協商原則。
第五、「對等、尊嚴、互惠」的互動原則。
這五原則當中，又以第二個原則－「九二共識，一中各表」－最為重要，因為從23年來「九二共識」的歷史觀察，兩岸關係與「九二共識」，彼此相合則旺，相離則傷，相反則盪。而「九二共識」的依據就是我國憲法，我方表達的「一中」當然就是中華民國，絕不會是「兩個中國」、「一中一臺」、或「臺灣獨立」。過去七年，我們依據「九二共識」所推動的兩岸政策，有效維護臺灣尊嚴，促進兩岸合作，成功創造了臺灣多數人支持的現狀。如果沒有「九二共識」，維持現狀就只是一句口號、一句空話，不可能具體落實，也不可能推動兩岸和平發展。
剛剛提到的「臺灣共識」與「兩岸共識」，就是讓兩岸關係與國際關係產生良性循環的基礎，如果下一任總統願意沿用，兩岸關係將繼續平順。事實上，不論哪一位當選總統，就職時依據憲法第48條宣誓，誓詞第一句就是「余謹以至誠，向全國人民宣誓，余必遵守憲法」。因此，一位中華民國總統，接受依據中華民國憲法達成的「九二共識」，合憲合法，理所當然，有什麼困難呢？
大陸當局最近就抗戰歷史提出「共享史料、共寫史書」的建議，我們抱持開放的態度。我們願意在「對等互惠」、「檔案公開」、「不設禁區」、「自由研究」的原則之下進行，並且不排除外國學者專家的參與。我們相信雙方如能誠實面對歷史，將拉近兩岸人民距離，有助兩岸和平發展。
四、結語
各位鄉親父老，在我任內，兩岸關係越來越和平穩定。但是，在國慶日的今天，我特別說出我的憂慮，一方面基於國家領導人的責任，二方面也是基於我對臺灣的感情。「人無遠慮，必有近憂」，我有必要在這個重要的場合，讓所有國人明白，臺灣將會面對什麼樣的未來，以及因應的方法。
各位鄉親，政府執政，就像是建築一條公路。我們的進度或許不夠快，但我們方向正確、計畫完整、基礎扎實，讓後人一上路就能大步向前。我相信，只要臺灣能堅持走這條正確的道路，我們現在享有的和平繁榮現狀就一定能繼續下去。
現在，請大家和我一起高呼：
中華民國萬歲！
臺灣民主萬歲！
謝謝大家。
::::::",總統蒞臨中華民國一○四年國慶大會致詞,2015-10-14,馬英九
20,"堅定向前，讓國家因改革而偉大
大會主席蘇嘉全院長、我們現場的貴賓、電視機前面及網路上全體國人同胞，大家早安，大家好！
今天是中華民國一百零五年的國慶。我要特別感謝遠道而來的各國貴賓，還有我們從世界各地回到故鄉臺灣的僑胞。謝謝大家，跟我們一起來見證這個莊嚴的國家慶典。
我也要特別謝謝陳金鋒先生，今天他離開了熟悉的棒球場，帶領所有人唱國歌。他是我們全臺灣人心目中的英雄。
在國家生日的這一天，我要向這麼多年來，曾經為這個國家奉獻和犧牲的人，致上我最深的敬意。
這個國家曾經走過威權統治、走過族群對立、也曾經走過國家認同的尖銳對立。對於過去，我們心中抱持感念。現在，新政府肩膀上的責任就是讓這個國家脫胎換骨。
在520就職演講中，我提到「改變年輕人的處境，就是改變國家的處境」。過去幾個月以來，我們所啟動的改革，每一項都是圍繞著這個主軸在前進。
年輕人憂慮房價太高、負擔太沉重，我們便著手辦理社會住宅。四年之內我們會辦理八萬戶，預計八年辦理二十萬戶。臺灣會跟許多先進國家一樣，變成一個社會住宅普及的國家。
年輕人要衝刺事業，政府要讓他們沒有後顧之憂。家中的長輩需要有人照顧，我們著手推動長照制度。家中的小朋友需要照顧，我們著手推動托育計畫。
我們的年金制度可能破產，我們用最嚴肅的態度來處理這個問題。在年金改革之後，年輕人的負擔會相對減少，年輕人也不用擔心繳交的費用，到老付諸流水，而且這個國家將公平地保障每一個國民退休之後，有尊嚴的生活。
同樣的道理，我們推動轉型正義。新政府要給予臺灣的民主政治一個嶄新的開始，給年輕人一個健康多元的民主政治，這就是推動轉型正義的真諦。
除了這些正在推動的政策之外，我們也正在推動經濟產業的振興。我們提出以創新研發為動能的「5+2」產業發展計畫。在前一段時期，這些計畫以及相關法規修正配套，也已經一一啟動。我們的目標很清楚，我們要為年輕人創造好的工作機會，提高他們的薪資。
產業轉型是振興這個國家經濟的根本之道，我們會堅定地往這條路邁進。但是這是一條漫長的路，不過，我們有決心，突破各種困難。政府已經提出擴大投資方案，從改善投資環境、激發民間投資、加強公營事業投資、以及強化創新等等，多管齊下，致力扭轉低迷多年的經濟。
我們的努力已經有初步的成效，上星期，我們在臺北舉行的全球招商大會。外資來臺的投資意向金額，已經創下近年新高。外資重燃對臺灣的信心，是因為我們有堅定的決心及改革的勇氣。臺灣經濟的振興及產業的轉型，關鍵就在我們自己。
親愛的國人同胞，改革的路上一定會有波折。不過，我誠懇呼籲全體國人，不要因為這些波折而對臺灣失去了希望。
這是有史以來第一次，這個國家的所有人，可以一起好好坐下來思考：我們到底要留下一個什麼樣的國家給年輕人？不要讓這個機會從我們手上溜走，決定權就在我們這一代人的手上。
新政府的藍圖很清楚，我們過去幾個月的作為，就是要讓這個國家脫離原地踏步的狀態。產業轉型帶領臺灣經濟發展，社會安全網確保國民的安全，年金改革確保國家財政與人民的退休生活，轉型正義要讓民主重新出發。同時，我們司法改革的準備工作也正在緊鑼密鼓進行中，一旦司法人事到位之後，改革就會加速進行。
我們堅持帶領國家往前走，方向已經確定，我們將會在這個方向上繼續前進，絕不退縮。
臺灣人民嚮往和平、追求民主、希望走出去，希望對國際社會做出貢獻。
新政府上任之後，秉持「踏實外交、互惠互助」的原則，我走訪了巴拉圭和巴拿馬兩個邦交國。會晤了巴拿馬、巴拉圭、多明尼加、宏都拉斯、貝里斯、薩爾瓦多、瓜地馬拉等國的元首或副元首。我們的副總統陳建仁先生則走訪了多明尼加及教廷。我們希望，外交不是單方面的投入，而是跟友邦攜手規劃互惠的合作計畫，讓雙方共蒙其利。
我們積極地走向世界，即使參與國際組織的路不好走，但是我們還會堅定地走下去。臺灣從來沒有在重要的全球性議題上缺席，即使受到壓力，我們依然要跟所有主要的民主國家一起努力，希望對人類做出有意義的貢獻。
在過去幾個月，我們和友邦進行了多場跨國的活動，包括疾病防治、能源效率、婦女賦權，以及為縮短區域數位落差所舉辦的電子商務訓練，以實際行動為區域發展做出貢獻。也在這段時間，我們和不同國家積極討論災害防救、海上搜救以及各項海事合作議題，建構區域合作的能量。臺灣能為國際社會做出貢獻，就是我們臺灣人民值得驕傲的成就。
新政府跟美國、日本，以及歐洲等民主國家的關係，在520之後，都有實質的成長。這些國家對於臺灣的國際參與議題，支持的力道也超過以往。在這裡，我要代表國家向這些國際上的好朋友，致上臺灣人誠摯的感謝。
同時，為重新定位臺灣在亞太地區的角色，並尋找新的成長動能，我們積極推動新南向政策，並且已擬定政策綱領及推動計畫。未來將在經貿、科技、教育、文化、觀光等方面，和東南亞、南亞、澳大利亞及紐西蘭等國家，加強互惠互助的合作關係，並透過廣泛的協商對話機制，建立合作共識，減少障礙。
我們和中國大陸在區域發展中扮演著不同的角色。臺灣將充分利用在人才培育、農業發展、科技創新、醫療、中小企業等領域的經驗及優勢，為區域發展做出積極貢獻。我們也願意在區域基礎建設及多邊經貿合作方面，和對岸進行協商，攜手合作，共同樹立歷史的里程碑。
對於兩岸關係，我要再次重申，建立具一致性、可預測、且可持續的兩岸關係，維持臺灣民主及臺海和平的現狀，是新政府堅定不移的立場。
「維持現狀」是我對選民的承諾。在520就職演說中，我的每一句話都未曾改變：新政府會依據中華民國憲法、兩岸人民關係條例及其他相關法律，處理兩岸事務。我們也會盡最大努力來維持兩岸間的對話與溝通機制，我們會尊重1992年兩岸兩會會談的歷史事實，也主張兩岸應該共同珍惜與維護1992年之後，20多年來雙方交流、協商所累積形成的現狀與成果，並在既有政治基礎上，持續推動兩岸關係和平穩定發展。我也呼籲，兩岸的兩個執政黨應該放下歷史包袱，展開良性對話，造福兩岸人民。
雖然過去幾個月，兩岸關係有些起伏，但我們的立場仍然一致而堅定。我們的承諾不會改變，我們的善意不會改變，我們也不會在壓力下屈服，更不會走回對抗的老路。這是我們對「維持現狀」的基本態度，也是基於對兩岸和平的共同願望。
我要強調，「維持現狀」更積極的意義，是在深化民主機制的基礎上，以更前瞻積極的作為，推動兩岸建設性的交流與對話，進而建構可長可久的兩岸和平穩定關係。
我要呼籲中國大陸當局，正視中華民國存在的事實，正視臺灣人民對於民主制度的堅信。兩岸之間應該要盡快坐下來談，只要有利於兩岸和平發展，有利於兩岸人民福祉，什麼都可以談。兩岸領導人應該共同展現智慧和彈性，以冷靜的態度，一起把兩岸現存的分歧帶向雙贏的未來。
從520到現在，過了一百多天，許多的工作，都逐步展開。我要在這裡特別感謝林全院長所領導的行政院團隊。改革沒有捷徑，走捷徑的改革通常不是真改革。為了讓國家真正脫胎換骨，新政府選擇一步一腳印，務實前進。有錯就改，對的事情，就堅持到底，不必憂讒畏譏。我想，這才是臺灣人民期待的政府。
今年六月，我拜訪巴拉圭的時候，卡提斯總統告訴我：「你的國家比你想像的更大」。在今天演講的最後，我就用這句話獻給我們全體國人。我們的任務，就是要讓人民相信，這個國家將因改革而偉大。
謝謝大家。祝我們的國家國運昌隆、一切順利。
謝謝。
::::::",總統蒞臨中華民國一○五年國慶大會致詞,2016-10-12,蔡英文
