id,text,title,date,president
14,"改革、開創、追求公義
大會主席立法院王院長、聖多美普林西比民主共和國梅尼士總統閣下、索羅門群島費立普總理閣下伉儷、甘比亞共和國國會芮內議長閣下、各國祝賀代表團及駐華使節、蕭副總統、各位院長、各位貴賓、各位僑胞、各位鄉親父老、各位媒體與電視機前的朋友，大家早安，大家好！
壹、中華民國與臺灣，緊密相連
今天是中華民國九十九年國慶日，我們紀念這個偉大的日子，除了緬懷當年革命志士為救亡圖存，所做的犧牲奉獻，更深知我們要負起承先啟後、繼往開來的歷史使命。
中華民國發展歷程曲折艱辛，在臺灣的每一個人，都是這段歷史的參與者與建構者。我們曾經抵擋了中共軍事進犯，確保臺澎金馬安全；我們奮力打拼，安然度過了多次世界經濟危機。在這塊土地上，我們胼手胝足，推動地方自治，普及國民教育，厚植國防實力，更開創了經濟繁榮與政治民主的雙重奇蹟，這是華人世界絕無僅有的成就，我們深以臺灣為傲。
今天我們在臺灣這塊土地上成長發展，大家承擔一樣的命運，擁抱一樣的夢想。我們疼惜臺灣，認同中華民國；希望臺灣好，希望中華民國強盛。明年，就是中華民國建國一百年，讓我們一起為我們的國家慶生，為中華民國開拓更精彩的第二個一百年！
貳、推動改革，勇往直前
各位鄉親父老，兩年前二次政黨輪替後，政府最重要的任務，就是「改革、開創、追求公義」。過去的鎖國貪腐，對臺灣傷害太深，我們必須勇於全面改革，一刻也不能放鬆。
兩年多來，政府在社會、經濟、教育、環保、國防、兩岸與外交各方面，推動許多劃時代的改革，目的是徹底改善臺灣體質，打造一個全新的、有競爭力的臺灣。
以「政府再造」為例，我們將行政院組織從37個機關減為29個，這是20年來許多任政府想做，卻無法做到的大工程，我們做到了。
我們實施縣市合併升格，舉行5個直轄市選舉，讓北中南平衡發展，提升城市競爭力，帶動區域經濟，這也是劃時代的變革，我們也做到了。
有人說，改革會得罪既得利益，失去選票，英九不認同這種說法，因為臺灣正在和時間賽跑，我們不能為了選舉拖延改革，否則就會對不起人民，對不起下一代。民眾眼睛是雪亮的，我相信，改革才能贏得未來；贏得未來，就能贏得民心。
各位鄉親父老，世界正在快速改變，臺灣必須重視亞太經濟整合與大陸經濟崛起，千萬不能像鴕鳥一樣，把頭埋在沙子裡。
這兩年多來，我們改善兩岸關係，促進和平繁榮，也同步擴大了國際參與。當兩岸開始直航、陸客來臺觀光時，我們也參加缺席38年的「世界衛生大會」(WHA)，加入曾經被拒絕6年的「政府採購協定」(GPA)，並與美國重建高層互信，恢復重要軍購，也重啟「貿易投資架構協議」（TIFA）的協商；我們與日本建立「特別伙伴關係」，去年12月在日本札幌設立辦事處，本月底實現臺北松山機場與東京羽田機場對飛；我們也爭取到英國、愛爾蘭、紐西蘭、斐濟等國家給予臺灣免簽證待遇，獲得歐洲議會多次通過決議支持，也增進與其他友好國家的實質關係。
我們與大陸簽署十四項協議，每一項協議都做到「對等、尊嚴、互惠」、「以臺灣為主，對人民有利」，捍衛了國家主權與臺灣尊嚴。
今年6月臺灣與大陸簽署的「兩岸經濟合作架構協議」(ECFA)，已經在9月12日生效。這是兩年來兩岸最重要的一項協議，為兩岸經濟合作開創新的里程碑，我們沒有開放大陸勞工與新的農產品進來，反而為臺灣農業、傳統產業與服務業爭取到新的商機，早收清單部分即可創造6萬個就業機會與1,900億元產值，讓臺灣加入亞太經濟整合行列，免於邊緣化，同時加速國際化。
各位鄉親父老，我們以務實政策，處理兩岸關係與外交關係，得到國際社會高度的肯定，政府改革的效益也已經逐漸顯現。行政院主計處預估，今年臺灣經濟成長率將高達8.24%，在亞洲名列前茅。在全世界前30大進出口國之中，今年前二季臺灣進口成長率是第一名，出口成長率為第二名；同時，今年上半年我們國內生產毛額(GDP)已經超過2008年同期、也就是金融海嘯前的水準，顯示臺灣景氣在衰退一年多之後，開始強勁復甦。一年來臺灣就業增加28萬5千人，8月份失業率降為5.17%，是19年來8月份首次下降，平均薪資也在增加，顯示勞動市場日趨活絡。
由於政府採取開放與鬆綁的政策，使臺灣競爭力大幅提升。瑞士洛桑國際管理發展學院今年5月公布「2010世界競爭力」報告，在58個受評比國家中，臺灣排名第8，比去年進步15名，這是16年來臺灣表現最好的一年，深信我們未來表現一定會更好。
臺灣經濟的好轉是全體國人共同努力的成果，但是在社會、環境、教育與司法方面，政府還有不小改善的空間，還需要虛心聆聽人民的聲音，不斷策勵改進。英九一定堅持改革，勇往直前，不負全民所託！
參、採取積極行動，回應人民期待
近來貧富差距、環境保護、教育改革與司法改革等議題，受到社會高度關注。英九在此要特別指出，我們施政的核心理念，就是「建立公義的社會」。英九保證，只要涉及社會正義、環境正義與司法正義的問題，一定採取積極行動，回應人民期待。
縮小貧富差距－首先，過去十年來臺灣貧富差距持續擴大，反映財富累積出現不平均現象。現在臺灣經濟固然快速復甦，但是經濟發展的果實，如果不能為全民分享，創造再高的經濟成長率又有什麼意義？
追求經濟成長固然重要，但經濟成長只是手段，目的要能建立繁榮均富的公義社會。所以，英九在此宣示，今後臺灣經濟發展的策略不會只注重成長，一定要做到成長與公平並重，也就是提高經濟成長的同時，一定要設法改善失業與貧窮問題。
政府將盡一切的努力，調整產業結構，增加就業機會；擴大社會福利，照顧社會弱勢，同時必須持續推動稅制改革。總之，政府絕不會坐視社會上有貧窮家庭求助無門。貧窮在那裡，政府的關懷與援助就要到那裡！
平衡經濟與環保－各位鄉親父老，去年莫拉克風災，有七百多位同胞失去寶貴生命。政府記取慘痛的教訓，一年多來，全力落實災後重建工作，並重整災防體系，督促中央機關與地方政府落實災害防救演習，提高各級政府與民眾的防災警覺，希望悲劇不再發生。
上個月凡那比颱風來襲前，中央部會、國軍、警察、消防人員，縣、市、鄉、鎮、村、里全部動員防災，預先撤離危險地區一萬六千多位民眾，將損害降到最少。像屏東來義部落幾十戶一百多人，如果沒有及時撤離，去年小林村悲劇可能重演。這也再一次印證：面對極端而多變的氣候，「防災重於救災，離災優於防災」、「料敵從寬、禦敵從嚴」、「超前部署，預置兵力，隨時防救」的策略是正確的。
近來中研院生技園區、中科環評和國光石化開發案，引發環保與經濟間的爭議。從國家永續發展的角度來看，環境保護與經濟發展應該兼籌並顧，如果經濟發展對環境有嚴重不良影響或危害時，應該以環保為優先。而影響或危害嚴重的程度，則應由科學的、理性的評估來決定。我們要追求經濟成長，但更要保護我們的環境和健康。
因此，更全面的土地關懷是必要的。我們要將重要的農地、山林、濕地、草原、河川等環境敏感地區，以及文化資產或景觀優美的地區，優先復育保護；同時我們也要改善產業結構，改進現行環評制度，使國土規劃和環評作業密切結合。往後對於土地開發或徵收，政府必須多傾聽民意，貼近土地，從長思考，以追求國土永續發展。
深化教育改革－各位鄉親父老，孩子是我們未來的希望，英九保證一定加速凝聚共識，創造條件，推動十二年國民教育；我們先將國民教育向下延伸一年，讓5歲幼童免學費入學，今年已從離島與偏遠地區做起，明年將會擴及全國。
同時，我們絕對不能忘記貧苦弱勢的孩子。我們必須透過教育資源的重新分配，扭轉不利弱勢學生的學習環境，協助貧苦子弟從學校獲得有效的知識技能，以翻身脫貧。我們一定要讓貧苦的孩子，同樣有實現人生夢想的機會！
啟動全民司改－近來法官收賄、法院裁判品質與效率問題，遭到社會嚴厲批評。我們認為司法當然必須獨立，可是不能孤立於社會、不能背離人民的合理期待。司法一定要能保護善良的人民，這是最起碼的正義。
未來的司法改革必須是「全民的司法改革」，應該從民眾的角度，理解人民對司法的期待與人民經歷訴訟的苦痛。現在司法院新的正副院長已經產生，加上半年前就任的法務部長與檢察總長，形成一個新的司法團隊，深信他們一定會回應社會期待，成為「全民司改」的主要推手。政府部門也將同心協力，檢討相關法制與流程，改進裁判品質，提升效率，建立友善的法庭環境，並儘速通過「法官法」，建立法官、檢察官評鑑機制，擇優汰劣，重建人民對司法的信任。
我們設立廉政署，就是要打擊貪腐，展現全面肅貪防貪的決心。政府一定除惡務盡，絕不與腐敗勢力妥協。
人權保障也是司法正義重要的一環，去年5月，我們批准二項聯合國人權公約─「公民與政治權利國際公約」、「經濟社會文化權利國際公約」，並積極修正不符兩公約標準的國內法規。為進一步促進人權與基本自由的發展與保障，英九現在宣布在總統府成立「人權諮詢委員會」，由蕭副總統擔任召集人，進行籌備工作，將邀集政府與民間人士，一同探討、規劃人權政策，並定期發表人權報告，以提升臺灣人權水準。
肆、推展兩岸關係，擴大國際參與
各位鄉親父老，近來兩岸關係大幅改善，臺海緊張情勢明顯緩和。大陸當局最近表達有關撤除飛彈的言論，我們認為對兩岸關係有正面的意義，希望儘早實現。
當然，臺灣安全不能只寄望於兩岸關係的改善。因此發展自主國防力量，持續向外購買無法自製的防衛性武器，是我們必要與不變的政策。我們也將持續加強兩岸在經濟、文化、社會等各個層面的深度交流，累積互信，化解歧見，以維繫臺海持久和平。
中華民國是主權獨立的國家，我們是在中華民國憲法架構下，以「九二共識」為基礎，開展與大陸的關係。現階段兩岸之間，在法理上不可能「相互承認」，但應以務實的精神，做到彼此在事實上「互不否認」。
兩岸人民同屬中華民族，都是炎黃子孫，雙方在深化交流之際，希望在國際社會也能擴大合作，避免對立，逐步開啟互利雙贏的良性循環。
臺灣已經完全民主化，我們與對岸簽署任何協議，必須受到民意支持與國會監督。同時，政府也將在中華民國憲法的架構下，維持兩岸現階段「不統、不獨、不武」的現狀，秉持「以臺灣為主、對人民有利」的原則，捍衛中華民國主權，維護臺灣尊嚴。
今後，我們也會持續強化與所有邦交國以及美國、日本、東南亞、紐澳、歐盟等友邦間合作；積極爭取參與國際組織與活動；並以人道精神，對發展中的伙伴國家，提供援助；政府也將致力改善中華民國的國際地位，並以務實、彈性的作為，積極與貿易伙伴洽簽自由貿易協定或經濟合作協議，以達成「壯大臺灣，連結亞太，布局全球」的目標。
英九在此宣示，當前中華民國在世界的角色有四：第一是和平的締造者；第二是人道援助的提供者；第三是文化交流的推動者；第四是新科技與商機的創造者。臺灣面積雖小，卻胸懷遠大，我們樂於融入世界，勇於接受全球化的挑戰，並願意對國際社會作出貢獻。我們要讓中華民國在國際社會成為一個受人尊敬、讓人感動的國家。
伍、結語
各位鄉親父老，生活在臺灣這塊土地的人民，從來不向命運低頭，我們在橫逆中成長，逐步實現了國父孫中山先生民主共和的理想。展望未來，我們充滿信心，充滿希望！
民主自由已經成為臺灣的基本精神。豐富多元的生命力，讓臺灣的文化與生活形態，成為華人世界的標竿。我們年輕一輩，不論在學術、體育、藝術、餐飲、設計、發明各方面，經常在國際間大放異彩，從他們身上，我們看到臺灣的潛力、臺灣的自信與臺灣的希望。
各位鄉親父老，中華民國建國一百年即將到來。中華民國的第一個一百年，以動盪的時代開啟序幕，以和平發展寫下今天的輝煌成就。中華民國的第二個一百年，將以黃金十年為序曲，從現在開始，奏出嶄新的樂章。
這是我們對先賢先烈的承擔，也是我們對後代子孫的承諾！
現在，請大家和英九一起高呼：
中華民國萬歲！
臺灣民主萬歲！
謝謝大家！
::::::",總統蒞臨中華民國九十九年國慶大會致詞,2010-10-13,馬英九
15,"百年奮鬥民主臺灣
大會主席立法院王院長、布吉納法索總統龔保雷閣下、瓜地馬拉總統科隆閣下、諾魯總統史蒂芬閣下、帛琉總統陶瑞賓閣下伉儷、各位友邦副總統、總理、各國祝賀代表團及駐華使節、代表、蕭副總統、各位院長、各位貴賓、各位僑胞、各位先進父老、各位媒體與電視機前的朋友，大家早安，大家好！
壹、紀念辛亥雙十的意義
今天是中華民國一百歲生日，也是辛亥革命一百週年，我們以歡欣鼓舞的心情，一起為中華民國慶生，一起分享喜悅，一起跨越這個偉大、感人的時刻。一百年前的今天，國父孫中山先生領導發動震驚世界的武昌起義，一舉推翻滿清政府與千年帝制，創立亞洲第一個民主共和國—中華民國。今天不僅臺灣，世界各地的華人，包括中國大陸，都在紀念辛亥雙十。
今天我們要以莊嚴崇敬的心情，向懷抱理想、不畏犧牲的革命志士致敬。他們包括廣東的陸皓東、湖南的黃興、浙江的秋瑾、福建的林覺民、臺灣的羅福星。這些民國英雄，只是少數中的少數。過去一百年，從開國、北伐、抗戰、戡亂到保臺，不知折損多少仁人志士，他們絕大多數是無名英雄，奉獻了青春、犧牲了生命，卻照亮了中華民國的天空。
各位先進、各位同胞：辛亥雙十是海峽兩岸共同的記憶與資產。因此，英九要藉這個機會，呼籲大陸當局：紀念辛亥雙十，就不能忘記國父建國的理想是要建立一個自由、民主、均富的國家，大陸應該勇敢地朝這個方向邁進。紀念辛亥雙十，也不能割裂歷史，而必須呈現歷史原貌，正視中華民國存在的事實。中華民國的存在不是過去式，而是現在進行式，六十多年來中華民國在臺灣蓬勃發展，在世界發光發熱，未來我們還會繼續蓬勃發展，繼續發光發熱！
貳、中華民國在臺灣的再造
各位先進、各位同胞：中華民國在抗戰期間，犧牲了二千萬軍民的生命，臺灣才能結束日本殖民統治，回到中華民國版圖。如果沒有臺灣的回歸，內戰失利後，中華民國很可能在六十多年前就走入歷史，沒有機會新生，更不可能開啟海峽兩岸不同的發展歷程。
六十多年來，中華民國不僅保障了臺澎金馬的安全，延續了中華文化的命脈，創造了臺灣經濟與政治的奇蹟，實現了臺灣先賢追求議會自治的理想，而且還向世人證明：民主可以在華人社會的土壤中生根、開花、結果。
今天，臺灣人民享有自由、民主、富足的生活，也凝聚對國家－中華民國－堅實的認同，中華民國憲法更早已成為全民共識的基礎。國父建國的理想，當年在大陸沒有機會實施，如今卻在臺灣完整實現。
今天，我們慶祝中華民國一百年雙十國慶，我們深深以中華民國為榮，深深以臺灣民主為傲。今天臺灣所展現的活力與生活方式，已成為華人世界的標竿。
臺灣面積不大，資源貧乏，我們卻能赤手空拳，開創一片天。今天放眼全球，無論在半導體、平板電腦、智慧型手機或太陽光電方面，臺灣產業不但角色重要，並對全球節能減碳貢獻卓著。今年5月瑞士國際管理學院(IMD)世界競爭力評比，臺灣排名世界第六，是有史以來最好的成績；今年9月世界經濟論壇(WEF)公布全球競爭力評比，我國競爭力分數創五年來最高分，排名全球第十三，其中有8項指標全球第一。
我們的年輕人才華橫溢，在設計、發明與文創領域，光芒耀眼，在全球六大發明展中屢屢奪魁。如今全球80%的華語音樂在臺灣創作，不論電影、戲劇、舞蹈、設計，我們都已經站上世界舞台。尤其我們的國片掀起一波波熱潮，臺灣新生代展現驚人的創作潛力，為臺灣電影發展開創無限可能。
臺灣社會也充滿愛心，現在臺灣有超過4萬個非營利組織，有上百萬志工在臺灣各角落默默服務，甚至遠赴海外，參與國際人道援助。去年我們的捐血率8％，在世界數一數二；我們認養了30萬貧童，20萬人在國外；每年慈善捐款超過350億元，絕大多數來自一般人民。
在臺灣這塊土地上，我們看到很多值得尊敬、實踐夢想的英雄。就像長年默默行善的阿嬤陳綢、陳樹菊與老榮民尹殿甲、洪中海、戰勝非洲瘧疾的連日清、挑戰超級馬拉松的林義傑、創意烘焙大師吳寶春、康復再起的王建民、拾金不昧的楊黃牡丹、驗出塑化劑的楊明玉、拍史詩電影的魏德聖、以及高球天后曾雅妮。從他們身上，我們看到了善良、勤奮與進取，更看到了堅持與希望，這是臺灣前進的原動力。
自由民主的中華民國、活力創新的中華民國、人文關懷的中華民國、開放自信的中華民國，這就是我們國家的形象。讓我們一起為中華民國喝采，向所有曾經為中華民國付出汗水與青春的英雄，表達我們最深的敬意！
參、黃金十年展布新局
各位先進，各位同胞：近三年來全球經濟動盪不安，臺灣仍以穩健的步伐，脫困而出，大幅提升國家競爭力，這是全民共同努力的成果。面對全球競爭壓力，未來十年將是關鍵的十年，我們要全面落實黃金十年的願景，在自信中開放，在創新中發展，在公義中前進，讓中華民國徹底脫胎換骨，躋身先進國家之林。
各位先進、各位同胞：兩岸和平是臺灣繁榮發展的必要條件。過去三年多，政府在中華民國憲法架構下，以「九二共識，一中各表」為基礎，推動兩岸關係，維持臺海「不統、不獨、不武」現狀，並得以大幅降低臺海緊張，贏得國際社會的肯定與支持。三年多來，我們與大陸簽署15項協議，每一項協議都做到了「對等、尊嚴、互惠」、「以臺灣為主，對人民有利」。兩岸人民同屬中華民族，希望雙方在正視現實的基礎上，求同存異，互助合作，建立制度化的和平關係。
如今大陸已經是臺灣最大的貿易夥伴、順差來源與投資地區，大陸也是驅動全球經濟成長的主要動力。我們要善用臺灣優勢，布局大陸市場，還要加快腳步，與其他國家洽簽自由貿易協定或經濟合作協議，為臺灣開創新的商機。上月22日，我們與日本簽署了投資協議，就是成功的案例。目前我們也正積極與新加坡協商經濟合作協議，我們還要參與區域經濟整合，努力創造條件，以十年為期，加入正在擴展中的「跨太平洋夥伴（TPP）協定」。
今後我們要繼續推動活路外交，更加鞏固與邦交國的關係，增進與美國、日本、歐盟、東協、紐澳等無邦交國的高層互信，並擴大國際參與。十天前，英國成為第七個與我國簽署青年打工度假協定的國家；五天前，荷蘭也給我們6個海外領土的免簽證待遇；後天布吉納法索給我們落地簽證待遇將正式生效，使國人享有免簽證或落地簽證的國家（地區）總數達到124個，比英九上任時增加了70個國家（地區）。這顯示當國家受到肯定，人民就有尊嚴。
各位先進、各位同胞：在推動兩岸關係時，臺海和平的維繫不能一廂情願，必須以堅實的國防為後盾，臺灣安全才有保障，民眾才有信心與大陸進一步改善關係。過去三年多，我們在部隊訓練、武器自製方面都有長足進步，並且多次成功採購先進的防衛性武器。未來的十年，我們將持續強化國防力量，打造精銳新國軍，以捍衛中華民國主權，保衛臺海安全。
肆、結語
各位先進、各位同胞：國父當年成立「興中會」時，成員只有二十幾位，可是他們堅持理想、勇於實踐，掌握了時代的脈動，十七年後竟然推翻滿清，建立民國。
今天我們紀念辛亥雙十，就要繼承先烈先賢這種理想主義，不怕風雨，勇於開創，讓我們的國家成為華人世界的典範。中華民國不只是國家的名字，也代表了自由民主的生活方式，對嚮往自由民主的華人地區也將產生示範作用。
光輝的十月，對英九而言，還有一項特殊意義。六十年前的十月，在風雨飄搖中，我的父母帶著家人和一歲多的我，從香港來到臺灣，追求自由安定的生活。他們萬萬沒有想到，他們的兒子在五十多年後會成為中華民國總統。對這個國家、對這塊土地，我懷著深深感恩的心情，我願意奉獻此生一切，努力建設臺灣，讓她成為自由繁榮的樂土，繼續哺育我們的下一代，讓每一個孩子，不論出身貧富，都能實現夢想。
就任總統三年多來，英九體會責任的艱鉅，不敢絲毫鬆懈。雖然世局多變，挑戰隨時出現，但我對這塊土地有信心，對人民有信心。
各位先進、各位同胞：中華民國是我們的國家，臺灣是我們的家園。中華民國的前途與臺灣的未來掌握在我們二千三百萬人的手中，我們要團結、要奮鬥，讓臺灣更有活力，更有魅力，也更有競爭力！
今天我們不分族群，不分黨派，不分海內外，一起為中華民國慶生。我們要發下宏願，一定要在我們的手中壯大臺灣、振興中華，為中華民國下一個精彩百年，打下基礎。讓中華民國在國際社會，成為一個更加受人尊敬、讓人感動的國家！
現在，讓我們一起高呼：
中華民國萬歲！
臺灣民主萬歲！
謝謝大家！
::::::",總統蒞臨中華民國一百年國慶大會致詞,2011-10-12,馬英九
